{
  "schemaVersion": "1.0.0",
  "policyVersion": "scheduled-job-attempt-v1",
  "availability": "operations_record_only",
  "mode": "synthetic_fixture",
  "attemptId": "attempt_b6f095c1fe7d8d591bada41f3cf32ffa1ef8957342a458f29e42476700a0fd78",
  "cycleId": "cycle_8104aaab3763f0366193c92d8bda9a4c464cc930b42b40c7b15bb677f206a353",
  "jobId": "job_54c9ba3917c707a34eead5220ff80a16ad9ba0eff108156ad2ee8f007d7ec05c",
  "environment": "shadow-eu",
  "lane": "recheck",
  "schedulePolicyRevisionId": "schedule-policy-example-v1",
  "scheduledFor": "2026-07-15T00:00:00Z",
  "targetType": "source_revision",
  "targetRevisionId": "source-revision-example-v1",
  "sourceRevisionId": "source-revision-example-v1",
  "attemptNumber": 1,
  "maxAttempts": 3,
  "workerIdentitySha256": "2222222222222222222222222222222222222222222222222222222222222222",
  "wakeup": {
    "kind": "queue",
    "opaqueDeliveryId": "delivery-example-1",
    "deliveryAttempt": 1,
    "authoritative": false
  },
  "lease": {
    "leaseId": "lease-example-1",
    "fencingToken": 1,
    "priorFencingToken": null,
    "acquiredAt": "2026-07-15T00:00:10Z",
    "expiresAt": "2026-07-15T00:10:10Z",
    "lastHeartbeatAt": "2026-07-15T00:01:00Z",
    "state": "released",
    "commitPresentedToken": 1,
    "commitDisposition": "accepted_current"
  },
  "timing": {
    "startedAt": "2026-07-15T00:00:15Z",
    "endedAt": "2026-07-15T00:02:00Z"
  },
  "stageReached": "claims_admitted",
  "outcome": "succeeded",
  "causeCode": "ATTEMPT_COMPLETED",
  "retry": {
    "classification": "none",
    "retryAt": null,
    "backoffSeconds": 0,
    "retryAfterSource": "none",
    "retryWindowEndsAt": "2026-07-15T02:00:00Z",
    "nextScheduledFor": "2026-07-15T12:00:00Z"
  },
  "outputReferences": [
    {
      "referenceType": "source_check_receipt",
      "referenceId": "source-check-receipt-example-v1",
      "contentSha256": "1111111111111111111111111111111111111111111111111111111111111111"
    },
    {
      "referenceType": "source_snapshot",
      "referenceId": "source-snapshot-example-v1",
      "contentSha256": "3333333333333333333333333333333333333333333333333333333333333333"
    }
  ],
  "authority": {
    "classification": "schedule_receipt_only",
    "certifiesSources": false,
    "authorizesCapture": false,
    "authorizesPublication": false,
    "frontendLoadable": false,
    "wakeupAuthoritative": false
  },
  "manifest": {
    "algorithm": "sha256-canonical-operations-json-v1",
    "contentSha256": "c64f75c21944a0845099c835376fb82e574a3f0bd1c6d823c3da16f700730b8a",
    "outputReferenceCount": 2
  }
}
